### ISSUE TITLE
Require assistance - Nginx server unreachable

### ISSUE THREAD

**Issue by dakshinai** [ansyun/dpdk-nginx#5]
I followed the instructions on readme but the nginx server is unreachable. Can any of the contributors assist me with debugging the issue over remote desktop? My network works fine with any other dpdk application.

**Comment by bluenet13** [comment]
Coud you please share your steps and detail log.

**Comment by dakshinai** [comment]
I downloaded dpdk from http://dpdk.org/browse/dpdk/snapshot/dpdk-2.2.0.tar.gz
make config T=x86_64-native-linuxapp-gcc
make install T=x86_64-native-linuxapp-gcc
export RTE_SDK=/dpdk-2.2.0
export RTE_TARGET=x86_64-native-linuxapp-gcc
Setup huge pages
insmod x86_64-native-linuxapp-gcc/kmod/igb_uio.ko 
tools/dpdk_nic_bind.py --bind=igb_uio 81:00.0
tools/dpdk_nic_bind.py --bind=igb_uio 81:00.1
(Devices on dpdk configured for ip 2.2.2.1 and 2.2.2.2)

export RTE_ODP=/git/dpdk-odp
cd /git/dpdk-odp/opendp
make
build/opendp -c 0x1 -n 1  -- -p 0x1 --config="(0,0,0)"
(Run log attached)

cd /git/dpdk-nginx/
./configure  --with-http_dav_module
edited conf/nginx to listen on 2.2.2.2:80 instead of 80
make
make install
objs/nginx
(Run log attached)

Connection failure on client (Client has ip 2.2.2.3/2.2.2.4)
root@dilangov2:~# wget http://2.2.2.2/index.html
--2016-03-02 13:03:40--  http://2.2.2.2/index.html
Connecting to 2.2.2.2:80... failed: Connection timed out.
Retrying.

--2016-03-02 13:05:48--  (try: 2)  http://2.2.2.2/index.html
Connecting to 2.2.2.2:80... 

[nginx run log.txt](https://github.com/opendp/dpdk-nginx/files/155585/nginx.run.log.txt)
[opendp run log.txt](https://github.com/opendp/dpdk-nginx/files/155586/opendp.run.log.txt)

**Comment by bluenet13** [comment]
hi,
- I test it in my env, it is successfully.
  root@h163:~# wget http://2.2.2.2/index.html
  --2016-03-03 08:37:59--  http://2.2.2.2/index.html
  Connecting to 2.2.2.2:80... connected.
  HTTP request sent, awaiting response... 200 OK
  Length: 612 [text/html]
  Saving to: ‘index.html.1’

100%[======================================>] 612         --.-K/s   in 0s

2016-03-03 08:37:59 (59.3 MB/s) - ‘index.html.1’ saved [612/612]
- You can check it by below way.

please ping 2.2.2.2 from your client to check if it is successfully.

Go to below directory, enable netdp debug log to check why netdp refuse the tcp connection.
root@h163:~/dpdk-odp# cd netdp_cmd/
root@h163:~/dpdk-odp/netdp_cmd# ./build/netdpcmd
netdp> log level set debug
Set log level successfully

**Comment by dakshinai** [comment]
Hi,

Thanks for your response. The wire connection seems fine when I test other dpdk applications. However with the current setup, ping 2.2.2.2 does not work for me so I can't get to the point to obtain logs.

Are there any other tests?

**Comment by bluenet13** [comment]
Maybe something are wrong with the NIC driver in odp_main.c. you can print  RX packets in odp_main_loop() to check if receive the packets from NIC, also print TX packets in odp_send_burst() to check if send packet to NIC.

**Comment by dakshinai** [comment]
I saw one packet received and transmitted initially.

root@dilangov1:/git/dpdk-odp/opendp# build/opendp -c 0x1 -n 1  -- -p 0x1 --config="(0,0,0)"
EAL: Detected lcore 0 as core 0 on socket 0
EAL: Detected lcore 1 as core 1 on socket 0
EAL: Detected lcore 2 as core 2 on socket 0
EAL: Detected lcore 3 as core 3 on socket 0
EAL: Detected lcore 4 as core 4 on socket 0
EAL: Detected lcore 5 as core 8 on socket 0
EAL: Detected lcore 6 as core 9 on socket 0
EAL: Detected lcore 7 as core 10 on socket 0
EAL: Detected lcore 8 as core 11 on socket 0
EAL: Detected lcore 9 as core 16 on socket 0
EAL: Detected lcore 10 as core 17 on socket 0
EAL: Detected lcore 11 as core 18 on socket 0
EAL: Detected lcore 12 as core 19 on socket 0
EAL: Detected lcore 13 as core 20 on socket 0
EAL: Detected lcore 14 as core 24 on socket 0
EAL: Detected lcore 15 as core 25 on socket 0
EAL: Detected lcore 16 as core 26 on socket 0
EAL: Detected lcore 17 as core 27 on socket 0
EAL: Detected lcore 18 as core 0 on socket 1
EAL: Detected lcore 19 as core 1 on socket 1
EAL: Detected lcore 20 as core 2 on socket 1
EAL: Detected lcore 21 as core 3 on socket 1
EAL: Detected lcore 22 as core 4 on socket 1
EAL: Detected lcore 23 as core 8 on socket 1
EAL: Detected lcore 24 as core 9 on socket 1
EAL: Detected lcore 25 as core 10 on socket 1
EAL: Detected lcore 26 as core 11 on socket 1
EAL: Detected lcore 27 as core 16 on socket 1
EAL: Detected lcore 28 as core 17 on socket 1
EAL: Detected lcore 29 as core 18 on socket 1
EAL: Detected lcore 30 as core 19 on socket 1
EAL: Detected lcore 31 as core 20 on socket 1
EAL: Detected lcore 32 as core 24 on socket 1
EAL: Detected lcore 33 as core 25 on socket 1
EAL: Detected lcore 34 as core 26 on socket 1
EAL: Detected lcore 35 as core 27 on socket 1
EAL: Detected lcore 36 as core 0 on socket 0
EAL: Detected lcore 37 as core 1 on socket 0
EAL: Detected lcore 38 as core 2 on socket 0
EAL: Detected lcore 39 as core 3 on socket 0
EAL: Detected lcore 40 as core 4 on socket 0
EAL: Detected lcore 41 as core 8 on socket 0
EAL: Detected lcore 42 as core 9 on socket 0
EAL: Detected lcore 43 as core 10 on socket 0
EAL: Detected lcore 44 as core 11 on socket 0
EAL: Detected lcore 45 as core 16 on socket 0
EAL: Detected lcore 46 as core 17 on socket 0
EAL: Detected lcore 47 as core 18 on socket 0
EAL: Detected lcore 48 as core 19 on socket 0
EAL: Detected lcore 49 as core 20 on socket 0
EAL: Detected lcore 50 as core 24 on socket 0
EAL: Detected lcore 51 as core 25 on socket 0
EAL: Detected lcore 52 as core 26 on socket 0
EAL: Detected lcore 53 as core 27 on socket 0
EAL: Detected lcore 54 as core 0 on socket 1
EAL: Detected lcore 55 as core 1 on socket 1
EAL: Detected lcore 56 as core 2 on socket 1
EAL: Detected lcore 57 as core 3 on socket 1
EAL: Detected lcore 58 as core 4 on socket 1
EAL: Detected lcore 59 as core 8 on socket 1
EAL: Detected lcore 60 as core 9 on socket 1
EAL: Detected lcore 61 as core 10 on socket 1
EAL: Detected lcore 62 as core 11 on socket 1
EAL: Detected lcore 63 as core 16 on socket 1
EAL: Detected lcore 64 as core 17 on socket 1
EAL: Detected lcore 65 as core 18 on socket 1
EAL: Detected lcore 66 as core 19 on socket 1
EAL: Detected lcore 67 as core 20 on socket 1
EAL: Detected lcore 68 as core 24 on socket 1
EAL: Detected lcore 69 as core 25 on socket 1
EAL: Detected lcore 70 as core 26 on socket 1
EAL: Detected lcore 71 as core 27 on socket 1
EAL: Support maximum 128 logical core(s) by configuration.
EAL: Detected 72 lcore(s)
EAL: VFIO modules not all loaded, skip VFIO support...
EAL: Setting up physically contiguous memory...
EAL: Ask a virtual area of 0x140000000 bytes
EAL: Virtual area found at 0x7f7a00000000 (size = 0x140000000)
EAL: Ask a virtual area of 0x40000000 bytes
EAL: Virtual area found at 0x7f7980000000 (size = 0x40000000)
EAL: Ask a virtual area of 0x100000000 bytes
EAL: Virtual area found at 0x7f7840000000 (size = 0x100000000)
EAL: Requesting 5 pages of size 1024MB from socket 0
EAL: Requesting 5 pages of size 1024MB from socket 1
EAL: TSC frequency is ~2294682 KHz
EAL: Master lcore 0 is ready (tid=cd1068c0;cpuset=[0])
EAL: PCI device 0000:01:00.0 on NUMA socket -1
EAL:   probe driver: 8086:1521 rte_igb_pmd
EAL:   Not managed by a supported kernel driver, skipped
EAL: PCI device 0000:01:00.1 on NUMA socket -1
EAL:   probe driver: 8086:1521 rte_igb_pmd
EAL:   Not managed by a supported kernel driver, skipped
EAL: PCI device 0000:81:00.0 on NUMA socket -1
EAL:   probe driver: 8086:10fb rte_ixgbe_pmd
EAL:   PCI memory mapped at 0x7f7b40000000
EAL:   PCI memory mapped at 0x7f7b40080000
PMD: eth_ixgbe_dev_init(): MAC: 2, PHY: 12, SFP+: 3
PMD: eth_ixgbe_dev_init(): port 0 vendorID=0x8086 deviceID=0x10fb
EAL: PCI device 0000:81:00.1 on NUMA socket -1
EAL:   probe driver: 8086:10fb rte_ixgbe_pmd
EAL:   PCI memory mapped at 0x7f7b40084000
EAL:   PCI memory mapped at 0x7f7b40104000
PMD: eth_ixgbe_dev_init(): MAC: 2, PHY: 12, SFP+: 4
PMD: eth_ixgbe_dev_init(): port 1 vendorID=0x8086 deviceID=0x10fb
param nb 1 ports 2 
port id 0 

Start to Init port 
     port 0:  
     port name rte_ixgbe_pmd:  
     max_rx_queues 128: max_tx_queues:128 
     rx_offload_capa 31: tx_offload_capa:63 
     Creating queues: rx queue number=1 tx queue number=1... 
     MAC Address:00:1B:21:44:F1:D8 
     lcore id:0, tx queue id:0, socket id:0 
PMD: ixgbe_dev_tx_queue_setup(): sw_ring=0x7f7b3fd1f7c0 hw_ring=0x7f7b3fd21800 dma_addr=0x23fd21800
PMD: ixgbe_set_tx_function(): Using simple tx code path
PMD: ixgbe_set_tx_function(): Vector tx enabled.

Skipping disabled port 1
Allocated mbuf pool on socket 0, mbuf number: 16384 

Initializing rx queues on lcore 0 ... 
port id:0, rx queue id: 0, socket id:0 
PMD: ixgbe_dev_rx_queue_setup(): sw_ring=0x7f7b3d64cbc0 sw_sc_ring=0x7f7b3d64c680 hw_ring=0x7f7b3d64d100 dma_addr=0x23d64d100
core mask: 1, sockets number:1, lcore number:1 
start to init netdp 
USER8: LCORE[0] lcore mask 0x1 
USER8: LCORE[0] lcore id 0 is enable 
USER8: LCORE[0] lcore number 1 
USER1: rte_ip_frag_table_create: allocated of 25165952 bytes at socket 0
USER8: LCORE[0] UDP layer init successfully, Use memory:4194304 bytes 
USER8: LCORE[0] TCP hash table init successfully, tcp pcb size 448 total size 27525120 
USER8: LCORE[0] so shm memory 17039360 bytes, so number 133120,  sock shm size 128 bytes 
USER8: LCORE[0] Sock init successfully, allocated of 42598400 bytes 
add eth0 device
add IP 2020202 on device eth0 

Skipping disabled port 1
Show interface 

eth0    HWaddr 00:1b:21:44:f1:d8
        inet addr:2.2.2.2
        inet addr:255.255.255.0
add static route 

Destination     Gateway     Netmask         Flags       Iface
2.2.2.0     \*       255.255.255.0       U C         0
2.2.2.5     \*       255.255.255.255     U H L       0
3.3.3.0     2.2.2.5     255.255.255.0       U G         0

USER8: LCORE[-1] NETDP mgmt thread startup 
PMD: ixgbe_set_rx_function(): Port[0] doesn't meet Vector Rx preconditions or RTE_IXGBE_INC_VECTOR is not enabled
PMD: ixgbe_set_rx_function(): Rx Burst Bulk Alloc Preconditions are satisfied. Rx Burst Bulk Alloc function will be used on port=0.

Checking link status .done
Port 0 Link Up - speed 10000 Mbps - full-duplex
**### Number of packets read=1**
USER8: main loop on lcore 0
USER8:  -- lcoreid=0 portid=0 rxqueueid=0
nb ports 2 hz: 2294682266 
**### Ret value in TX:1**
USER8: LCORE[0] Register app(129296) start 
USER8: LCORE[0] Add app(129296) in table, lcore:0 
USER8: LCORE[0] netdp recv app msg: type: 12  
USER8: LCORE[0] netdp epoll_create 
USER8: LCORE[0] alloc_socket(3), lcore(0) 
USER8: LCORE[0] shm_head addr 0x7f7b382b2e40, so shm: 0x7f7b382b2fc0, sock id 3  netdp_sock_shm 128 
USER8: LCORE[0] netdp_epcreate: fd 3 
 USER8: LCORE[0] netdp recv app msg: type: 12  
USER8: LCORE[0] netdp epoll_create 
USER8: LCORE[0] alloc_socket(4), lcore(0) 
USER8: LCORE[0] shm_head addr 0x7f7b382b2e40, so shm: 0x7f7b382b3040, sock id 4  netdp_sock_shm 128 
USER8: LCORE[0] netdp_epcreate: fd 4 
 USER8: LCORE[0] netdp recv app msg: type: 6  
USER8: LCORE[0] netdp_close(3)
USER8: LCORE[0] get_socket(3)
USER8: LCORE[0] free_socket(3) end, lcore(0)  
USER8: LCORE[0] netdp recv app msg: type: 2  
USER8: LCORE[0] netdp socket 
USER8: LCORE[0] alloc_socket(5), lcore(0) 
USER8: LCORE[0] shm_head addr 0x7f7b382b2e40, so shm: 0x7f7b382b30c0, sock id 5  netdp_sock_shm 128 
USER8: LCORE[0] Create tcp pcb successfully 
USER8: LCORE[0] netdp_socket(PF_INET, SOCK_STREAM, 0) 
USER8: LCORE[0] netdp recv app msg: type: 14  
USER8: LCORE[0] netdp_epwait: epfd:4 
USER8: LCORE[0] get_socket(4)
USER8: LCORE[0] epoll_waiting: no epoll event 
USER8: LCORE[0] netdp_epwait(4) succeeded
USER8: LCORE[0] netdp recv app msg: type: 3  
USER8: LCORE[0] netdp bind, fd:5 
USER8: LCORE[0] get_socket(5)
USER8: LCORE[0] netdp_bind:, fd:5, addr=0x2020202, port=80 
USER8: LCORE[0] Add pcb to port table successfully, reuse port 1 
USER8: LCORE[0] tcp_bind: bind to port 80, IP addr 0x2020202 
USER8: LCORE[0] netdp_bind(5) succeeded
USER8: LCORE[0] netdp recv app msg: type: 5  
USER8: LCORE[0] netdp_listen(fd=5, backlog=511)
USER8: LCORE[0] get_socket(5)
USER8: LCORE[0] netdp recv app msg: type: 5  
USER8: LCORE[0] netdp_listen(fd=5, backlog=511)
USER8: LCORE[0] get_socket(5)
USER8: LCORE[0] netdp recv app msg: type: 12  
USER8: LCORE[0] netdp epoll_create 
USER8: LCORE[0] alloc_socket(6), lcore(0) 
USER8: LCORE[0] shm_head addr 0x7f7b382b2e40, so shm: 0x7f7b382b3140, sock id 6  netdp_sock_shm 128 
USER8: LCORE[0] netdp_epcreate: fd 6 
 USER8: LCORE[0] netdp recv app msg: type: 13  
USER8: LCORE[0] netdp epoll_ctl, fd:5, epfd:6 
USER8: LCORE[0] get_socket(5)
USER8: LCORE[0] get_socket(6)
USER8: LCORE[0] netdp_epctl(epfd:6, op=0x1, fd=5) 
USER8: LCORE[0] epoll add: events 0x2019 
USER8: LCORE[0] netdp_conn_epctl: remove epoll out 
USER8: LCORE[0] sock(5) epoll event isn't in event list 
USER8: LCORE[0] netdp_epctl(5) succeeded
USER8: LCORE[0] netdp recv app msg: type: 14  
USER8: LCORE[0] netdp_epwait: epfd:6 
USER8: LCORE[0] get_socket(6)
USER8: LCORE[0] epoll_waiting: no epoll event 
USER8: LCORE[0] netdp_epwait(6) succeeded

Also, I do not see any active connection listening at port 80

root@dilangov1:~# netstat -lptu
Active Internet connections (only servers)
Proto Recv-Q Send-Q Local Address           Foreign Address         State       PID/Program name
tcp        0      0 _:5900                  *:_                     LISTEN      3366/vino-server
tcp        0      0 localhost:26002         _:_                     LISTEN      108342/nxnode.bin
tcp        0      0 dilangov1:domain        _:_                     LISTEN      2142/dnsmasq  
tcp        0      0 localhost:ipp           _:_                     LISTEN      102467/cupsd  
tcp        0      0 localhost:afs3-callback _:_                     LISTEN      3420/nxnode.bin 
tcp        0      0 localhost:21018         _:_                     LISTEN      2393/nxserver.bin
tcp        0      0 localhost:20000         _:_                     LISTEN      108309/nxserver.bin
tcp        0      0 _:4000                  *:_                     LISTEN      2525/nxd  
tcp        0      0 localhost:12001         _:_                     LISTEN      3420/nxnode.bin 
tcp        0      0 localhost:12002         _:_                     LISTEN      108342/nxnode.bin
tcp        0      0 localhost:25001         _:_                     LISTEN      3482/nxclient.bin
tcp6       0      0 [::]:5900               [::]:\*                  LISTEN      3366/vino-server
tcp6       0      0 ip6-localhost:ipp       [::]:\*                  LISTEN      102467/cupsd  
tcp6       0      0 ip6-local:afs3-callback [::]:\*                  LISTEN      3420/nxnode.bin 
tcp6       0      0 [::]:4000               [::]:\*                  LISTEN      2525/nxd  
tcp6       0      0 [::]:12865              [::]:\*                  LISTEN      2359/netserver  
tcp6       0      0 [::]:5800               [::]:\*                  LISTEN      3366/vino-server
udp        0      0 _:36991                 *:_                                 3420/nxnode.bin 
udp   214528      0 dilangov1.jf.intel:mdns _:_                                 2393/nxserver.bin
udp        0      0 _:mdns                  *:_                                 2393/nxserver.bin
udp     8448      0 2.2.2.1:mdns            _:_                                 3420/nxnode.bin 
udp     8448      0 2.2.2.2:mdns            _:_                                 3420/nxnode.bin 
udp    61440      0 dilangov1.jf.intel:mdns _:_                                 3420/nxnode.bin 
udp   213504      0 _:mdns                  *:_                                 3420/nxnode.bin 
udp        0      0 _:mdns                  *:_                                 1449/avahi-daemon: 
udp        0      0 _:57082                 *:_                                 1449/avahi-daemon: 
udp        0      0 _:32668                 *:_                                 2111/dhclient  
udp        0      0 dilangov1:domain        _:_                                 2142/dnsmasq  
udp        0      0 _:bootpc                *:_                                 2111/dhclient  
udp        0      0 _:ipp                   *:_                                 1506/cups-browsed
udp6       0      0 [::]:34888              [::]:\*                              1449/avahi-daemon: 
udp6       0      0 [::]:51856              [::]:\*                              2111/dhclient  
udp6       0      0 [::]:mdns               [::]:\*                              1449/avahi-daemon: 

as it would do in a normal nginx-kernel stack
tcp        0      0 _:http                  *:_                     LISTEN      136295/nginx

**Comment by bluenet13** [comment]
1. netdp tcp stack is correct. app create socket in netdp, and bind 80 to the socket, and then listen on the socket. 
2. netdp didn't print the socket connection. Refer to the log, netdp tcp stack didn't receive any tcp packets.
3. So please focus on the icmp traffic, why can't ping successfully from you client. please ping 2.2.2.2 from your client continuously. check how many packets are received at the NIC, and how many packets are sent at the NIC. 
4. Please print more information(eg, IP header and eth header) of the packets at odp_main.c.

**Comment by bluenet13** [comment]
I think odp_main.c can't receive the packets from the dpdk NIC.
You many enable Promiscuous mode with below command.
build/opendp -c 0x1 -n 1 -- -P -p 0x1 --config="(0,0,0)"

**Comment by dakshinai** [comment]
Hello,

I printed some packets stats in odp_main. 

Packet 1 sent
Ethernet Dst Addr:FF:FF:FF:FF:FF:FF
Ethernet Src Addr:00:1B:21:44:F1:D8
Ethernet Type:1544
Packet 1 received
Ethernet Dst Addr:01:00:5E:00:00:FB
Ethernet Src Addr:90:E2:BA:2C:8E:EC
Ethernet Type:8
Src IP:2.2.2.3 Dst IP:224.0.0.251 Src port:5353,Dst port:5353 
Packet 1 received
Ethernet Dst Addr:01:00:5E:00:00:FB
Ethernet Src Addr:90:E2:BA:2C:8E:EC
Ethernet Type:8
Src IP:2.2.2.3 Dst IP:224.0.0.251 Src port:5353,Dst port:5353 
Packet 1 received
Ethernet Dst Addr:01:00:5E:00:00:FB
Ethernet Src Addr:90:E2:BA:2C:8E:EC
Ethernet Type:8
Src IP:2.2.2.3 Dst IP:224.0.0.251 Src port:5353,Dst port:5353 
Packet 1 received
Ethernet Dst Addr:01:00:5E:00:00:FB
Ethernet Src Addr:90:E2:BA:2C:8E:EC
Ethernet Type:8
Src IP:2.2.2.3 Dst IP:224.0.0.251 Src port:5353,Dst port:5353 
Packet 1 received
Ethernet Dst Addr:01:00:5E:00:00:FB
Ethernet Src Addr:90:E2:BA:2C:8E:EC
Ethernet Type:8
Src IP:2.2.2.3 Dst IP:224.0.0.251 Src port:5353,Dst port:5353 
Packet 1 received
Ethernet Dst Addr:01:00:5E:00:00:FB
Ethernet Src Addr:90:E2:BA:2C:8E:EC
Ethernet Type:8
Src IP:2.2.2.3 Dst IP:224.0.0.251 Src port:5353,Dst port:5353 

Looks like an ARP message is received initially. Remaining tx messages belong to an external udp process running on port 5333.

Please help!

**Comment by bluenet13** [comment]
1. Please ping from your client, and tcpdump the packets.
2. Please try this way to startup opendp,  build/opendp -c 0x1 -n 1 -- -P -p 0x1 --config="(0,0,0)"

**Comment by dakshinai** [comment]
Hello,

I do not see any messages flowing through except for the ARP requests by client

tcpdump -nni eth7
tcpdump: verbose output suppressed, use -v or -vv for full protocol decode
listening on eth7, link-type EN10MB (Ethernet), capture size 262144 bytes
23:53:36.995683 ARP, Request who-has 2.2.2.2 tell 2.2.2.4, length 28
23:53:37.995480 ARP, Request who-has 2.2.2.2 tell 2.2.2.4, length 28
23:53:38.995492 ARP, Request who-has 2.2.2.2 tell 2.2.2.4, length 28

Can I have a video sharing session with you so that I can show you the stack?

**Comment by bluenet13** [comment]
Can you try dpdk l3fwd example, if it run successfully and traffic transfer successfully?

**Comment by dakshinai** [comment]
With my current setup I tried running l2fwd on server and test-pmd on client to transmit a burst of packets from client to server. l2fwd reported stats.

Sample output on server running l2fwd
Port statistics ====================================
Statistics for port 0 ------------------------------
Packets sent:                213580044
Packets received:            212171008
Packets dropped:                     0
Statistics for port 1 ------------------------------
Packets sent:                212171008
Packets received:            213580044
Packets dropped:                     0

Sample output on client running testpmd

 ---------------------- Forward statistics for port 0  ----------------------
  RX-packets: 0              RX-dropped: 0             RX-total: 0
  TX-packets: 32             TX-dropped: 0             TX-total: 32

---

  ---------------------- Forward statistics for port 1  ----------------------
  RX-packets: 0              RX-dropped: 0             RX-total: 0
  TX-packets: 32             TX-dropped: 0             TX-total: 32

---

  +++++++++++++++ Accumulated forward statistics for all ports+++++++++++++++
  RX-packets: 0              RX-dropped: 0             RX-total: 0
  TX-packets: 64             TX-dropped: 0             TX-total: 64
  ++++++++++++++++++++++++++++++++++++++++++++++++++++++++++++++++++++++++++++

I'm not able to get stats from l3fwd so tested with l2fwd.

**Comment by bluenet13** [comment]
1. Please try below NIC configuration. replace below code in  in odp_main.c

static struct rte_eth_conf odp_port_conf = 
{
    .rxmode = 
       {
        .mq_mode = ETH_MQ_RX_NONE,
        .max_rx_pkt_len = ETHER_MAX_LEN,
        .split_hdr_size = 0,
        .header_split   = 0,      /**< Header Split disabled */
        .hw_ip_checksum = 1, /**< IP checksum offload enabled _/
        .hw_vlan_filter = 0,     /__< VLAN filtering disabled */
        .jumbo_frame    = 0,   /__< Jumbo Frame Support disabled */
        .hw_strip_crc   = 0,    /_*< CRC stripped by hardware */
    },
    .txmode = 
    {
        .mq_mode = ETH_MQ_TX_NONE,
    },
};
1. Did you try below command? which add "-P" parameter to enable promiscuous.
   build/opendp -c 0x1 -n 1 -- -P -p 0x1 --config="(0,0,0)"

**Comment by bluenet13** [comment]
You can talk in the web room.

https://opendp.hipchat.com/home , the room name is opendp

**Comment by dakshinai** [comment]
I was able to see packets flowing in the server once i ping from the client, but I'm not able to isolate to which program they belong to. They have source port 0/2048. The ping does not work though on the client. 

Src IP:2.2.2.3 Dst IP:2.2.2.2 Src port:2048,Dst port:40608 
Packet 1 sent
Ethernet Dst Addr:90:E2:BA:2C:8E:EC
Ethernet Src Addr:00:1B:21:44:F1:D8
Ethernet Type:8
Src IP:2.2.2.2 Dst IP:2.2.2.3 Src port:0,Dst port:42656 
Packet 1 received
Ethernet Dst Addr:00:1B:21:44:F1:D8
Ethernet Src Addr:90:E2:BA:2C:8E:EC
Ethernet Type:8

I have requested access to join the team opendp. Do I need to wait on approval to sign up first on hipchat?

**Comment by bluenet13** [comment]
I didn't see your request to join the team opendp. needn't sign up first on hipchat.

Please download latest code to try. For the NIC issue, it is hard do troubleshoot, you may get help from your colleague.

**Comment by dakshinai** [comment]
The new code shows the same results. Could you tell me why I do not see a nginx process created?

Also can you invite me to the opendp room by my email "akdaks08@gmail.com"

**Comment by bluenet13** [comment]
You shall startup up opendp(a tcp/ip stack) at firstly, and then startup nginx(application).
Please read the readme in dpdk-nginx carefully.

**Comment by bluenet13** [comment]
Please try below steps.
1. tcpdump as a file on the client pc when ping 2.2.2.2. 
2. open the file with Wireshark tools to check if the packets is correct, if the checksum isn't correct, maybe your NIC didn't support HW checksum.  please disable the HW checksum in odp_main.c, 
    init_conf.hw_ip_checksum = NETDP_HW_CHKSUM_DISABLE;
    init_conf.max_sock_conn = 1024 \* 130;
    init_conf.max_tcp_conn_per_lcore = 1024 \* 60;
3. Please send the packets to me by email. my email is zimeiw@163.com.

**Comment by dakshinai** [comment]
Hello,

I did start nginx after starting opendp. Once I disabled hw_ip_checksum the ping worked successfully. I still do not see a nginx process and wget failed. I saw this message in the nginx process.

2016/03/22 12:16:21 [info] 105229#0: *1 client 2.2.2.3 closed keepalive connection
2016/03/22 12:20:19 [info] 105229#0: *2 client 2.2.2.3 closed keepalive connection

At the server

wget http://2.2.2.2/index.html
--2016-03-22 20:39:44--  http://2.2.2.2/index.html
Connecting to 2.2.2.2:80... connected.
HTTP request sent, awaiting response... ^C

I have emailed you the pcap files.

**Comment by bluenet13** [comment]
1. You may clone the opendp latest code from  github, it could enable HW checksum because the NIC config is changed.
2. What is the nginx log?
3. You may enable opendp debug log by "netdpcmd> log level set debug"  command, and share the opendp log.

**Comment by bluenet13** [comment]
It seems the tcp connection is established,  see below log. 
"Connecting to 2.2.2.2:80... connected"
Please tcpdump the tcp packets. and you can also try "ab" to test the tcp.

**Comment by dakshinai** [comment]
**I cloned the latest copy of opendp and nginx. Nginx server crashes after wget/ab.**

USER8: LCORE[-1] netdpsock any lcore id 0xffffffff 
USER8: LCORE[1] netdpsock app id: 114281 
USER8: LCORE[1] netdpsock app name: nginx 
USER8: LCORE[1] netdpsock app bind lcoreId: 0 
USER8: LCORE[1] netdpsock app bind queueId: 0 
USER8: LCORE[1] netdpsock app lcoreId: 1 
skip linux fd 5 
2016/03/23 03:42:51 [notice] 114281#0: using the "epoll" event method
2016/03/23 03:42:51 [notice] 114281#0: nginx/1.9.5
2016/03/23 03:42:51 [notice] 114281#0: built by gcc 5.2.1 20151010 (Ubuntu 5.2.1-22ubuntu2) 
2016/03/23 03:42:51 [notice] 114281#0: OS: Linux 4.2.0-19-generic
2016/03/23 03:42:51 [notice] 114281#0: getrlimit(RLIMIT_NOFILE): 1024:65536
Segmentation fault (core dumped)

**Opendp log**
USER8: LCORE[0] Register app(114281) start 
USER8: LCORE[0] Add app(114281) in table, lcore:0 
USER8: LCORE[0] netdp recv app msg: type: 12  
USER8: LCORE[0] netdp epoll_create 
USER8: LCORE[0] alloc_socket(3), lcore(0) 
USER8: LCORE[0] shm_head addr 0x7ff6782b2e40, so shm: 0x7ff6782b2fc0, sock id 3  netdp_sock_shm 128 
USER8: LCORE[0] netdp_epcreate: fd 3 
 USER8: LCORE[0] netdp recv app msg: type: 12  
USER8: LCORE[0] netdp epoll_create 
USER8: LCORE[0] alloc_socket(4), lcore(0) 
USER8: LCORE[0] shm_head addr 0x7ff6782b2e40, so shm: 0x7ff6782b3040, sock id 4  netdp_sock_shm 128 
USER8: LCORE[0] netdp_epcreate: fd 4 
 USER8: LCORE[0] netdp recv app msg: type: 6  
USER8: LCORE[0] netdp_close(3)
USER8: LCORE[0] get_socket(3)
USER8: LCORE[0] free_socket(3) end, lcore(0)  
USER8: LCORE[0] netdp recv app msg: type: 2  
USER8: LCORE[0] netdp socket 
USER8: LCORE[0] alloc_socket(5), lcore(0) 
USER8: LCORE[0] shm_head addr 0x7ff6782b2e40, so shm: 0x7ff6782b30c0, sock id 5  netdp_sock_shm 128 
USER8: LCORE[0] Create tcp pcb successfully 
USER8: LCORE[0] netdp_socket(PF_INET, SOCK_STREAM, 0) 
USER8: LCORE[0] netdp recv app msg: type: 14  
USER8: LCORE[0] netdp_epwait: epfd:4 
USER8: LCORE[0] get_socket(4)
USER8: LCORE[0] epoll_waiting: no epoll event 
USER8: LCORE[0] netdp_epwait(4) succeeded
USER8: LCORE[0] netdp recv app msg: type: 3  
USER8: LCORE[0] netdp bind, fd:5 
USER8: LCORE[0] get_socket(5)
USER8: LCORE[0] netdp_bind: fd:5, addr=0x2020202, port=80 
USER8: LCORE[0] Add pcb to port table successfully, reuse port 1 
USER8: LCORE[0] tcp_bind: bind to port 80, IP addr 0x2020202 
USER8: LCORE[0] netdp_bind(5) succeeded
USER8: LCORE[0] netdp recv app msg: type: 5  
USER8: LCORE[0] netdp_listen(fd=5, backlog=511)
USER8: LCORE[0] get_socket(5)
USER8: LCORE[0] netdp recv app msg: type: 5  
USER8: LCORE[0] netdp_listen(fd=5, backlog=511)
USER8: LCORE[0] get_socket(5)
USER8: LCORE[0] netdp recv app msg: type: 12  
USER8: LCORE[0] netdp epoll_create 
USER8: LCORE[0] alloc_socket(6), lcore(0) 
USER8: LCORE[0] shm_head addr 0x7ff6782b2e40, so shm: 0x7ff6782b3140, sock id 6  netdp_sock_shm 128 
USER8: LCORE[0] netdp_epcreate: fd 6 
 USER8: LCORE[0] netdp recv app msg: type: 13  
USER8: LCORE[0] netdp epoll_ctl, fd:5, epfd:6 
USER8: LCORE[0] get_socket(5)
USER8: LCORE[0] get_socket(6)
USER8: LCORE[0] netdp_epctl(epfd:6, op=0x1, fd=5) 
USER8: LCORE[0] epoll add: events 0x2019 
USER8: LCORE[0] netdp_conn_epctl: remove epoll out 
USER8: LCORE[0] sock(5) epoll event isn't in event list 
USER8: LCORE[0] netdp_epctl(5) succeeded
USER8: LCORE[0] netdp recv app msg: type: 14  
USER8: LCORE[0] netdp_epwait: epfd:6 
USER8: LCORE[0] get_socket(6)
USER8: LCORE[0] epoll_waiting: no epoll event 
USER8: LCORE[0] netdp_epwait(6) succeeded
USER8: LCORE[0] tcp_input: src IP: 3020202, dest IP: 2020202, rss: 8768ae 
USER8: LCORE[0] tcp_input: src port: 43332, dest port: 80, seqno: 3758107382, ackno: 0, wnd:29200, flags:2
USER8: LCORE[0] Lookup hash table, src ip:2020202, dst ip: 3020202, src port:20480, dst port:17577 
USER8: LCORE[0] tcp_input: no find pcb from hash table 
USER8: LCORE[0] tcp_input: LISTENing pcb, ip addr: 0x2020202 , port 80 
USER8: LCORE[0] tcp_input: LISTENing connection, loop_num 0, reuse_ctrl 0,  reuse_port 1.
USER8: LCORE[0] tcp_input: packed for LISTENing connection, pcb(0x7ff6798cf6c0) 
USER8: LCORE[0] TCP connection request  17577 -> 20480.
USER8: LCORE[0] Create tcp pcb successfully 
USER8: LCORE[0] Add hash table, src ip:2020202, dst ip: 3020202, src port:20480, dst port:17577 
USER8: LCORE[0] Add hash table successfully 
USER8: LCORE[0] tcp_parseopt: MSS
USER8: LCORE[0] tcp_parseopt: other
USER8: LCORE[0] tcp_parseopt: TS
USER8: LCORE[0] tcp_parseopt: NOP
USER8: LCORE[0] tcp_parseopt: other
USER8: LCORE[0] tcp_enqueue_flags: queuelen: 0 
USER8: LCORE[0] tcp_create_segment: optlen: 16, data len: 0, data off 128 
 USER8: LCORE[0] tcp_enqueue_flags: queueing 1897462078:1897462079 (0x12)
USER8: LCORE[0] tcp_enqueue_flags: 1 (after enqueued)
USER8: LCORE[0] tcp_output: snd_wnd 29200, cwnd 1, wnd 1, seg len 0, effwnd 0, seq 1897462078, ack 1897462078 
USER8: LCORE[0] State: SYN_RCVD
USER8: LCORE[0] tcp_output loop: snd_wnd 29200, cwnd 1, wnd 1, seg len 0, effwnd 0, seq 1897462078, ack 1897462078, nagle value 1 
USER8: LCORE[0] tcp_output_segment: start seqno 1897462078: next seqno 1897462078
USER8: LCORE[0] tcp_output_segment: rtseq 1897462078 
USER8: LCORE[0] tcp_output_segment: 1897462078:1897462078
USER8: LCORE[0] tcp transmit: send to ip layer, pkt len 56, tcp remote port 43332 
USER8: LCORE[0] tcp transmit, error 0 
USER8: LCORE[0] arp_input: ifindex: eth0, op: 2, src IP: 3020202, dst IP: 2020202 , myaddr: 2020202 , sdl index: 0 
USER8: LCORE[0] tcp_input: src IP: 3020202, dest IP: 2020202, rss: 8768ae 
USER8: LCORE[0] tcp_input: src port: 43332, dest port: 80, seqno: 3758107383, ackno: 1897462079, wnd:29200, flags:10
USER8: LCORE[0] Lookup hash table, src ip:2020202, dst ip: 3020202, src port:20480, dst port:17577 
USER8: LCORE[0] Lookup hash table successfully 
USER8: LCORE[0] TCP flags:USER8: LCORE[0] ACK USER8: LCORE[0] 
USER8: LCORE[0] State: SYN_RCVD
USER8: LCORE[0] tcp_parseopt: NOP
USER8: LCORE[0] tcp_parseopt: NOP
USER8: LCORE[0] tcp_parseopt: TS
USER8: LCORE[0] alloc_socket(7), lcore(0) 
USER8: LCORE[0] netdp_accept_cb: newpcb->state: 4, app_id 114281, sock_id 7 
USER8: LCORE[0] shm_head addr 0x7ff6782b2e40, so shm: 0x7ff6782b31c0, sock id 7  netdp_sock_shm 128 
USER8: LCORE[0] sock(5) epoll event is inserted in event list of lcore index(0) 
USER8: LCORE[0] epoll: sem post to app, maxevents 1 
USER8: LCORE[0] tcp_receive: seqno:3758107383, ackno:1897462079 
USER8: LCORE[0] tcp_receive: window update 29200 
USER8: LCORE[0] tcp_receive: slow start cwnd 1461 
USER8: LCORE[0] tcp_receive: ACK for 1897462079, unacked->seqno 1897462078 :1897462079 
USER8: LCORE[0] tcp_receive: removing 1897462078 :1897462079  from pcb->unacked
USER8: LCORE[0] tcp_receive: queuelen 1 ... 
USER8: LCORE[0] snd_queuelen 0 (after freeing unacked)
USER8: LCORE[0] tcp_receive: pcb->rttest 0 rtseq 1897462078 ackno 1897462079
USER8: LCORE[0] TCP connection established 17577 -> 20480. cwnd 14600, ssthresh 29200 
USER8: LCORE[0] State: ESTABLISHED
USER8: LCORE[0] tcp_input: end 
USER8: LCORE[0] tcp_input: src IP: 3020202, dest IP: 2020202, rss: 8768ae 
USER8: LCORE[0] tcp_input: src port: 43332, dest port: 80, seqno: 3758107383, ackno: 1897462079, wnd:29200, flags:18
USER8: LCORE[0] Lookup hash table, src ip:2020202, dst ip: 3020202, src port:20480, dst port:17577 
USER8: LCORE[0] Lookup hash table successfully 
USER8: LCORE[0] TCP flags:USER8: LCORE[0] PSH USER8: LCORE[0] ACK USER8: LCORE[0] 
USER8: LCORE[0] State: ESTABLISHED
USER8: LCORE[0] tcp_parseopt: NOP
USER8: LCORE[0] tcp_parseopt: NOP
USER8: LCORE[0] tcp_parseopt: TS
USER8: LCORE[0] tcp_receive: seqno:3758107383, ackno:1897462079 
USER8: LCORE[0] tcp_receive: pcb->rttest 0 rtseq 1897462078 ackno 1897462079
USER8: LCORE[0] tcp_receive: seq in window, seqno 3758107383, rcv_nxt 3758107383, rcv_wnd 64512 
USER8: LCORE[0] pcb established, flag:0 
USER8: LCORE[0] recv tcp packets, fwd to app, fd 7, pkt len 144 
USER8: LCORE[0] sobuf put, sb_cnt 0, sb_byte 0 
USER8: LCORE[0] tcp_recved: recveived 144 bytes, wnd 64512 (0).
USER8: LCORE[0] netdp_tcp_recv_cb: No register epoll socket 
USER8: LCORE[0] State: ESTABLISHED
USER8: LCORE[0] tcp_input: end 
USER8: LCORE[0] tcp_input: src IP: 3020202, dest IP: 2020202, rss: 8768ae 
USER8: LCORE[0] tcp_input: src port: 43332, dest port: 80, seqno: 3758107383, ackno: 1897462079, wnd:29200, flags:18
USER8: LCORE[0] Lookup hash table, src ip:2020202, dst ip: 3020202, src port:20480, dst port:17577 
USER8: LCORE[0] Lookup hash table successfully 
USER8: LCORE[0] TCP flags:USER8: LCORE[0] PSH USER8: LCORE[0] ACK USER8: LCORE[0] 
USER8: LCORE[0] State: ESTABLISHED
USER8: LCORE[0] tcp_parseopt: NOP
USER8: LCORE[0] tcp_parseopt: NOP
USER8: LCORE[0] tcp_parseopt: TS
USER8: LCORE[0] tcp_receive: seqno:3758107383, ackno:1897462079 
USER8: LCORE[0] tcp_receive: pcb->rttest 0 rtseq 1897462078 ackno 1897462079
USER8: LCORE[0] tcp_receive: duplicate seqno 3758107383 
USER8: LCORE[0] tcp_receive: segment is not withing the window, seqno 3758107383, rcv_nxt 3758107527, rcv_wnd 64512 
USER8: LCORE[0] tcp_send_empty_ack: sending ACK for 3758107527 
USER8: LCORE[0] tcp transmit: send to ip layer, pkt len 52, tcp remote port 43332 
USER8: LCORE[0] tcp transmit, error 0 
USER8: LCORE[0] pcb established, flag:0 
USER8: LCORE[0] State: ESTABLISHED
USER8: LCORE[0] tcp_input: end 
USER8: LCORE[-1]  app (PID 114281) has terminated 
USER8: LCORE[-1] Process(114281) has terminated 
USER8: LCORE[-1]  send msg to lcore(0), app (PID 114281) has terminated, 114281 
USER8: LCORE[0] clear socket, recv app_id: 114281, so app_id: 114281, fd:4 
USER8: LCORE[0] netdp_close(4)
USER8: LCORE[0] get_socket(4)
USER8: LCORE[0] free_socket(4) end, lcore(0)  
USER8: LCORE[0] clear socket, recv app_id: 114281, so app_id: 114281, fd:5 
USER8: LCORE[0] netdp_close(5)
USER8: LCORE[0] get_socket(5)
USER8: LCORE[0] netdp_conn_delete, state: 1, type:16 
USER8: LCORE[0] tcp_close: closing in 
USER8: LCORE[0] tcp_close_shutdown: rcv_wnd:64512 
USER8: LCORE[0] State: LISTEN
USER8: LCORE[0] tcp_close_shutdown: state: 1 
USER8: LCORE[0] tcp_pcb_remove: tcp_pcbs_sane() 
USER8: LCORE[0] Delete pcb to port table successfully, reuse port 0 
USER8: LCORE[0] tcp_free 
USER8: LCORE[0] netdp_conn_free: remove epoll event 
USER8: LCORE[0] Remove sock(5) epoll event from event list 
USER8: LCORE[0] free_socket(5) end, lcore(0)  
USER8: LCORE[0] clear socket, recv app_id: 114281, so app_id: 114281, fd:6 
USER8: LCORE[0] netdp_close(6)
USER8: LCORE[0] get_socket(6)
USER8: LCORE[0] free_socket(6) end, lcore(0)  
USER8: LCORE[0] clear socket, recv app_id: 114281, so app_id: 114281, fd:7 
USER8: LCORE[0] netdp_close(7)
USER8: LCORE[0] get_socket(7)
USER8: LCORE[0] netdp_conn_delete, state: 0, type:16 
USER8: LCORE[0] tcp_close: closing in 
USER8: LCORE[0] tcp_close_shutdown: rcv_wnd:64512 
USER8: LCORE[0] State: ESTABLISHED
USER8: LCORE[0] tcp_close_shutdown: state: 4 
USER8: LCORE[0] tcp_send_fin: start 
USER8: LCORE[0] tcp_enqueue_flags: queuelen: 0 
USER8: LCORE[0] tcp_create_segment: optlen: 12, data len: 0, data off 128 
 USER8: LCORE[0] tcp_enqueue_flags: queueing 1897462079:1897462080 (0x1)
USER8: LCORE[0] tcp_enqueue_flags: 1 (after enqueued)
USER8: LCORE[0] tcp_output: snd_wnd 29200, cwnd 14600, wnd 14600, seg len 0, effwnd 0, seq 1897462079, ack 1897462079 
USER8: LCORE[0] State: FIN_WAIT_1
USER8: LCORE[0] tcp_output loop: snd_wnd 29200, cwnd 14600, wnd 14600, seg len 0, effwnd 0, seq 1897462079, ack 1897462079, nagle value 1 
USER8: LCORE[0] tcp_output_segment: start seqno 1897462079: next seqno 1897462079
USER8: LCORE[0] tcp_output_segment: rtseq 1897462079 
USER8: LCORE[0] tcp_output_segment: 1897462079:1897462079
USER8: LCORE[0] tcp transmit: send to ip layer, pkt len 52, tcp remote port 43332 
USER8: LCORE[0] tcp transmit, error 0 
USER8: LCORE[0] free_socket(7) end, lcore(0)  
USER8: LCORE[0] tcp_input: src IP: 3020202, dest IP: 2020202, rss: 8768ae 
USER8: LCORE[0] tcp_input: src port: 43332, dest port: 80, seqno: 3758107527, ackno: 1897462080, wnd:29200, flags:11
USER8: LCORE[0] Lookup hash table, src ip:2020202, dst ip: 3020202, src port:20480, dst port:17577 
USER8: LCORE[0] Lookup hash table successfully 
USER8: LCORE[0] TCP flags:USER8: LCORE[0] FIN USER8: LCORE[0] ACK USER8: LCORE[0] 
USER8: LCORE[0] State: FIN_WAIT_1
USER8: LCORE[0] tcp_parseopt: NOP
USER8: LCORE[0] tcp_parseopt: NOP
USER8: LCORE[0] tcp_parseopt: TS
USER8: LCORE[0] tcp_receive: seqno:3758107527, ackno:1897462080 
USER8: LCORE[0] tcp_receive: window update 29200 
USER8: LCORE[0] tcp_receive: slow start cwnd 16060 
USER8: LCORE[0] tcp_receive: ACK for 1897462080, unacked->seqno 1897462079 :1897462080 
USER8: LCORE[0] tcp_receive: removing 1897462079 :1897462080  from pcb->unacked
USER8: LCORE[0] tcp_receive: queuelen 1 ... 
USER8: LCORE[0] snd_queuelen 0 (after freeing unacked)
USER8: LCORE[0] tcp_receive: pcb->rttest 1 rtseq 1897462079 ackno 1897462080
USER8: LCORE[0] tcp_receive: experienced rtt 0 ticks (0 msec).
USER8: LCORE[0] tcp_receive: RTO 5 (2500 milliseconds)
USER8: LCORE[0] tcp_receive: seq in window, seqno 3758107527, rcv_nxt 3758107527, rcv_wnd 64512 
USER8: LCORE[0] tcp_receive: received FIN.
USER8: LCORE[0] TCP connection closed: FIN_WAIT_1 17577 -> 20480.
USER8: LCORE[0] tcp_pcb_purge
USER8: LCORE[0] tcp_send_empty_ack: sending ACK for 3758107528 
USER8: LCORE[0] tcp transmit: send to ip layer, pkt len 52, tcp remote port 43332 
USER8: LCORE[0] tcp transmit, error 0 
USER8: LCORE[0] State: TIME_WAIT
USER8: LCORE[0] tcp_input: end 
USER8: LCORE[0] tcp_input: src IP: 3020202, dest IP: 2020202, rss: c9c83846 
USER8: LCORE[0] tcp_input: src port: 43334, dest port: 80, seqno: 2659282436, ackno: 0, wnd:29200, flags:2
USER8: LCORE[0] Lookup hash table, src ip:2020202, dst ip: 3020202, src port:20480, dst port:18089 
USER8: LCORE[0] tcp_input: no find pcb from hash table 
USER8: LCORE[0] TCP flags:USER8: LCORE[0] SYN USER8: LCORE[0] 
USER8: LCORE[0] tcp_input: no PCB match found, resetting.
USER8: LCORE[0] tcp_rst: seqno 0 ackno 2659282437, local ip: 2020202, remote ip: 3020202 .
USER8: LCORE[0] tcp_rst: seqno 0 ackno 2659282437.
^C

I could not see any nginx process in netstat, neither the access or error logs.

**On client side**

Ping worked fine but wget and ab failed as follows

root@dilangov2:/# wget http://2.2.2.2:80/index.html
--2016-03-23 12:02:52--  http://2.2.2.2/index.html
Connecting to 2.2.2.2:80... connected.
HTTP request sent, awaiting response... No data received.
Retrying.

--2016-03-23 12:02:53--  (try: 2)  http://2.2.2.2/index.html
Connecting to 2.2.2.2:80... failed: Connection refused.

ab -n 30000 -c 500 2.2.2.2:80/
This is ApacheBench, Version 2.3 <$Revision: 1638069 $>
Copyright 1996 Adam Twiss, Zeus Technology Ltd, http://www.zeustech.net/
Licensed to The Apache Software Foundation, http://www.apache.org/

Benchmarking 2.2.2.2 (be patient)
apr_socket_recv: Connection refused (111)
Total of 500 requests completed

I have emailed you the tcpdump capturing tcp packets.

**Comment by bluenet13** [comment]
1. after you update opendp code, you shall compiled nginx again. because the static lib is updated. otherwise it would crash.
2. the tcp connection is established in netdp(fastpath tcp/ip stack), you can get the connection by netstat tool, netstat only get the connection from linux kernel.

**Comment by dakshinai** [comment]
I downloaded the latest version of opendp and nginx.

This is the setting in my nginx.conf

server {
        listen       2.2.2.2:80;
        #server_name  localhost;

I'm in PST time zone. Could you suggest a time post noon? I can be online on Slack.

**Comment by bluenet13** [comment]
Tomorrow i will online all day

**Comment by dakshinai** [comment]
Hello, I'm online now.

**Comment by dakshinai** [comment]
Thank you so much for your patience in helping me resolve the issue. With HW checksum enabled in the code and NIC, I was able to test successfully.
